{
  "id": "recipe_mud_shoes",
  "type": "recipe",
  "name": "Lashing mud shoes",
  "process": "process_carving",
  "ingredients": [
    {
      "tag": "#timber",
      "count": 2
    },
    {
      "item": "item_reed_rope"
    }
  ],
  "outputs": [
    {
      "item": "item_mud_shoes"
    }
  ],
  "notes": "Splayed frames under the foot. A salt flat becomes ground you can cross. Any straight timber does: cane by preference, but windfall, mangrove pole or teak hold as well, on the owner's ruling of 2 October 2026 that a recipe names one species only where the species is the point.",
  "canon": "inferred",
  "sources": [
    "inferred from canon geography"
  ],
  "source_index": 19
}
